{
  "version": "1.0",
  "variant": "risk",
  "status": "success",
  "title": "风险检查 · 教师003 与 教师007",
  "verified": true,
  "summary": "发现 1 处时间冲突、1 处跨校区赶场。",
  "sections": [
    {
      "title": "时间冲突",
      "rows": [
        {
          "label": "周二 undefined",
          "value": "高等数学 ↔ 线性代数",
          "badge": "冲突",
          "hint": "校区A A4-101 vs 校区B B2-101"
        }
      ]
    },
    {
      "title": "跨校区赶场",
      "rows": [
        {
          "label": "周三 · 间隔 10 分钟",
          "value": "操作系统 → 大学英语",
          "badge": "赶场",
          "hint": "校区A → 校区B"
        }
      ]
    }
  ],
  "actions": [
    {
      "id": "risk-resolve",
      "type": "sys.chat",
      "label": "看看怎么调整",
      "payload": {
        "query": "针对冲突给出调课建议"
      }
    },
    {
      "id": "risk-other-week",
      "type": "sys.chat",
      "label": "检查其他周",
      "payload": {
        "query": "检查另一个教学周的风险"
      }
    }
  ],
  "displayMeta": {}
}
